{
  "updated": "2026-03-17",
  "region": "Львівська область",
  "sources": {
    "gp": "Нафтогаз, березень 2026",
    "rdm": "oree.com.ua, індекс РДН, березень 2026",
    "trans": "НКРЕКП, тариф на передачу",
    "distr": "Львівобленерго, 2 клас напруги, Q1 2026",
    "hp": "ЛТЕ, орієнтовна ціна тепла"
  },
  "defaults": {
    "gp": 24600,
    "rdm": 6358,
    "trans": 713,
    "distr": 2112,
    "hp": 1800,
    "sh": 1,
    "vrfW": 0.35,
    "vrfS": 0.25,
    "elB": 0.45,
    "capex": 32000000,
    "opex": 4,
    "av": 0.92
  }
}
